{
    "$schema": "http://json-schema.org/draft-07/schema#",
    "id": "",
    "title": "Member format base",
    "descriptions": "Member format for import and export. By Sharon Wong",
    "type": "object",
    "properties": {
        "_id": {
            "type": "string"
        },
        "firstName": {
            "type": "string",
            "minLength": 1,
            "maxLength": 40
        },
        "lastName": {
            "type": "string",
            "minLength": 1,
            "maxLength": 40
        },
        "email": {
            "type": "string",
            "format": "email"
        },
        "role": {
            "type": "string",
            "enum": ["member", "admin"]
        },
        "password": {
            "type": "string"
        }
    },
    "required": ["firstName", "lastName", "email", "role", "password"],
    "additionalProperties": false
}
